{
  "id": "Serpent_Ground",
  "tribe": "Serpent_Ground",
  "name": "Surfent Terra",
  "paldexNumber": 75,
  "rarity": 5,
  "elements": [
    "Earth"
  ],
  "hp": 90,
  "attack": 90,
  "defense": 100,
  "runSpeed": 500,
  "stamina": 100,
  "food": 3,
  "breedingRank": 1840,
  "nocturnal": false,
  "workSuitability": {
    "Collection": 3
  }
}