{
  "id": "KendoFrog_Dark",
  "tribe": "KendoFrog_Dark",
  "name": "Croajiro Noct",
  "paldexNumber": 9,
  "rarity": 5,
  "elements": [
    "Water",
    "Dark"
  ],
  "hp": 85,
  "attack": 110,
  "defense": 90,
  "runSpeed": 300,
  "stamina": 100,
  "food": 2,
  "breedingRank": 1860,
  "nocturnal": true,
  "workSuitability": {
    "Watering": 1,
    "Handcraft": 2,
    "Collection": 1,
    "Transport": 1
  }
}