{
  "id": "StuffedShark",
  "tribe": "StuffedShark",
  "name": "Finsider",
  "paldexNumber": 88,
  "rarity": 3,
  "elements": [
    "Water"
  ],
  "hp": 75,
  "attack": 85,
  "defense": 80,
  "runSpeed": 250,
  "stamina": 100,
  "food": 2,
  "breedingRank": 2450,
  "nocturnal": false,
  "workSuitability": {
    "Watering": 2,
    "Transport": 1
  }
}