{
  "id": "Kitsunebi",
  "tribe": "Kitsunebi",
  "name": "Foxparks",
  "paldexNumber": 29,
  "rarity": 1,
  "elements": [
    "Fire"
  ],
  "hp": 65,
  "attack": 75,
  "defense": 70,
  "runSpeed": 400,
  "stamina": 100,
  "food": 1,
  "breedingRank": 2990,
  "nocturnal": false,
  "workSuitability": {
    "EmitFlame": 1
  }
}