{
  "id": "PoseidonOrca",
  "tribe": "PoseidonOrca",
  "name": "Neptilius",
  "paldexNumber": 201,
  "rarity": 20,
  "elements": [
    "Water"
  ],
  "hp": 105,
  "attack": 145,
  "defense": 125,
  "runSpeed": 750,
  "stamina": 410,
  "food": 9,
  "breedingRank": 160,
  "nocturnal": false,
  "workSuitability": {
    "Watering": 7
  }
}