{
  "id": "FoxMage",
  "tribe": "FoxMage",
  "name": "Wixen",
  "paldexNumber": 78,
  "rarity": 6,
  "elements": [
    "Fire"
  ],
  "hp": 90,
  "attack": 110,
  "defense": 80,
  "runSpeed": 440,
  "stamina": 100,
  "food": 4,
  "breedingRank": 2080,
  "nocturnal": false,
  "workSuitability": {
    "EmitFlame": 3,
    "Handcraft": 3,
    "Transport": 2
  }
}