{
  "id": "BerryGoat_Dark",
  "tribe": "BerryGoat_Dark",
  "name": "Caprity Noct",
  "paldexNumber": 34,
  "rarity": 3,
  "elements": [
    "Dark"
  ],
  "hp": 100,
  "attack": 75,
  "defense": 90,
  "runSpeed": 400,
  "stamina": 100,
  "food": 2,
  "breedingRank": 1940,
  "nocturnal": true,
  "workSuitability": {
    "Seeding": 2,
    "MonsterFarm": 1
  }
}