{
  "id": "Plesiosaur",
  "tribe": "Plesiosaur",
  "name": "Braloha",
  "paldexNumber": 110,
  "rarity": 8,
  "elements": [
    "Leaf",
    "Earth"
  ],
  "hp": 130,
  "attack": 95,
  "defense": 120,
  "runSpeed": 600,
  "stamina": 270,
  "food": 7,
  "breedingRank": 1030,
  "nocturnal": false,
  "workSuitability": {
    "Seeding": 5,
    "Collection": 5,
    "Mining": 3
  }
}