{
  "id": "HoodGhost",
  "tribe": "HoodGhost",
  "name": "Hoodle",
  "paldexNumber": 166,
  "rarity": 3,
  "elements": [
    "Dark"
  ],
  "hp": 70,
  "attack": 85,
  "defense": 80,
  "runSpeed": 400,
  "stamina": 100,
  "food": 3,
  "breedingRank": 1770,
  "nocturnal": true,
  "workSuitability": {
    "Handcraft": 1,
    "Transport": 1
  }
}