{
  "id": "WhiteAlienDragon",
  "tribe": "WhiteAlienDragon",
  "name": "Xenogard",
  "paldexNumber": 146,
  "rarity": 9,
  "elements": [
    "Dragon"
  ],
  "hp": 110,
  "attack": 120,
  "defense": 130,
  "runSpeed": 790,
  "stamina": 250,
  "food": 7,
  "breedingRank": 990,
  "nocturnal": false,
  "workSuitability": {
    "Mining": 4
  }
}