{"id":"GrassRabbitMan","tribe":"GrassRabbitMan","name":"Verdash","paldexNumber":152,"rarity":8,"elements":["Leaf"],"hp":90,"attack":115,"defense":90,"runSpeed":500,"stamina":100,"food":6,"breedingRank":1160,"nocturnal":false,"workSuitability":{"Seeding":4,"Handcraft":5,"Collection":5,"Deforest":3,"Transport":3}}