{
  "id": "Mothman",
  "tribe": "Mothman",
  "name": "Silvance",
  "paldexNumber": 193,
  "rarity": 8,
  "elements": [
    "Leaf"
  ],
  "hp": 140,
  "attack": 120,
  "defense": 110,
  "runSpeed": 500,
  "stamina": 100,
  "food": 9,
  "breedingRank": 80,
  "nocturnal": false,
  "workSuitability": {
    "Seeding": 6,
    "Handcraft": 6,
    "Collection": 4,
    "ProductMedicine": 8,
    "Transport": 2
  }
}