{
  "id": "CatMage",
  "tribe": "CatMage",
  "name": "Katress",
  "paldexNumber": 79,
  "rarity": 6,
  "elements": [
    "Dark"
  ],
  "hp": 90,
  "attack": 105,
  "defense": 90,
  "runSpeed": 440,
  "stamina": 100,
  "food": 4,
  "breedingRank": 2040,
  "nocturnal": true,
  "workSuitability": {
    "Handcraft": 3,
    "ProductMedicine": 3,
    "Transport": 2
  }
}