{"id":"ScorpionMan_Electric","tribe":"ScorpionMan_Electric","name":"Prixter Lux","paldexNumber":141,"rarity":6,"elements":["Electricity","Earth"],"hp":90,"attack":115,"defense":90,"runSpeed":720,"stamina":100,"food":5,"breedingRank":850,"nocturnal":false,"workSuitability":{"GenerateElectricity":3,"Collection":2,"Deforest":4,"ProductMedicine":2}}