{
  "id": "BlueberryFairy",
  "tribe": "BlueberryFairy",
  "name": "Prunelia",
  "paldexNumber": 147,
  "rarity": 5,
  "elements": [
    "Leaf",
    "Dark"
  ],
  "hp": 105,
  "attack": 95,
  "defense": 100,
  "runSpeed": 550,
  "stamina": 100,
  "food": 5,
  "breedingRank": 1390,
  "nocturnal": true,
  "workSuitability": {
    "Seeding": 3,
    "Handcraft": 1,
    "Collection": 2,
    "ProductMedicine": 3,
    "Transport": 1
  }
}