{
  "id": "Ronin",
  "tribe": "Ronin",
  "name": "Bushi",
  "paldexNumber": 85,
  "rarity": 7,
  "elements": [
    "Fire"
  ],
  "hp": 80,
  "attack": 125,
  "defense": 80,
  "runSpeed": 600,
  "stamina": 100,
  "food": 5,
  "breedingRank": 1560,
  "nocturnal": false,
  "workSuitability": {
    "EmitFlame": 2,
    "Handcraft": 2,
    "Collection": 1,
    "Deforest": 3,
    "Transport": 2
  }
}