{
  "id": "KingAlpaca",
  "tribe": "KingAlpaca",
  "name": "Kingpaca",
  "paldexNumber": 21,
  "rarity": 8,
  "elements": [
    "Normal"
  ],
  "hp": 120,
  "attack": 85,
  "defense": 90,
  "runSpeed": 700,
  "stamina": 170,
  "food": 4,
  "breedingRank": 2220,
  "nocturnal": false,
  "workSuitability": {
    "Collection": 2
  }
}