{
  "id": "ThunderBird_Ice",
  "tribe": "ThunderBird_Ice",
  "name": "Beakon Cryst",
  "paldexNumber": 96,
  "rarity": 7,
  "elements": [
    "Ice"
  ],
  "hp": 105,
  "attack": 115,
  "defense": 85,
  "runSpeed": 750,
  "stamina": 160,
  "food": 5,
  "breedingRank": 580,
  "nocturnal": false,
  "workSuitability": {
    "Collection": 2,
    "Cool": 5,
    "Transport": 5
  }
}